{
  "$schema": "http://json-schema.org/draft-07/schema#",
  "title": "Plan JSON Schema",
  "description": "Schema for Narratoria Plan JSON documents generated by narrator AI",
  "type": "object",
  "required": ["requestId", "tools"],
  "properties": {
    "requestId": {
      "type": "string",
      "description": "Unique identifier for this plan execution",
      "minLength": 1
    },
    "narrative": {
      "type": "string",
      "description": "Optional narrative text to display to player"
    },
    "tools": {
      "type": "array",
      "description": "Array of tool invocation descriptors",
      "minItems": 1,
      "items": {
        "type": "object",
        "required": ["toolId", "toolPath", "input"],
        "properties": {
          "toolId": {
            "type": "string",
            "description": "Unique ID for this tool within the plan",
            "minLength": 1
          },
          "toolPath": {
            "type": "string",
            "description": "Filesystem path to tool executable",
            "minLength": 1
          },
          "input": {
            "type": "object",
            "description": "JSON object passed to tool via stdin"
          },
          "dependencies": {
            "type": "array",
            "description": "Array of toolId values that must complete first",
            "items": {
              "type": "string"
            },
            "default": []
          }
        }
      }
    },
    "parallel": {
      "type": "boolean",
      "description": "Whether tools can run concurrently (if dependencies allow)",
      "default": false
    }
  }
}
